{
  "definitions": {}, 
  "$schema": "http://json-schema.org/draft-06/schema#", 
  "$id": "http://example.com/example.json", 
  "type": "object", 
  "additionalProperties": true, 
  "properties": {
    "name": {
      "type": "string", 
      "title": "The Name Schema.", 
      "description": "An explanation about the purpose of this instance.", 
      "default": "", 
      "examples": [
        "Demo Session Data"
      ]
    }, 
    "description": {
      "type": "string", 
      "title": "The Description Schema.", 
      "description": "An explanation about the purpose of this instance.", 
      "default": "", 
      "examples": [
        "Session data over one day for an ecommerce client"
      ]
    }, 
    "theme": {
      "type": "string", 
      "title": "The Theme Schema.", 
      "description": "An explanation about the purpose of this instance.", 
      "default": "", 
      "examples": [
        "default"
      ]
    }, 
    "data_format": {
      "type": "string", 
      "title": "The Data_fomat Schema.", 
      "description": "An explanation about the purpose of this instance.", 
      "default": "", 
      "examples": [
        "tsv"
      ]
    }, 
    "stages": {
      "type": "array", 
      "additionalItems": true, 
      "uniqueItems": true, 
      "items": {
        "type": "object", 
        "additionalProperties": true, 
        "properties": {
          "id": {
            "type": "integer", 
            "title": "The Id Schema.", 
            "description": "An explanation about the purpose of this instance.", 
            "default": 0, 
            "examples": [
              1
            ]
          }, 
          "anchortext": {
            "type": "string", 
            "title": "The Anchortext Schema.", 
            "description": "An explanation about the purpose of this instance.", 
            "default": "", 
            "examples": [
              "start"
            ]
          }, 
          "description": {
            "type": "string", 
            "title": "The Description Schema.", 
            "description": "An explanation about the purpose of this instance.", 
            "default": "", 
            "examples": [
              "shows all available data in a cloud"
            ]
          }, 
          "displaytext": {
            "type": "string", 
            "title": "The Displaytext Schema.", 
            "description": "An explanation about the purpose of this instance.", 
            "default": "", 
            "examples": [
              "{{count(*)}} sessions detected on {{appname}} on the day of {{date}}."
            ]
          }, 
          "dimensions": {
            "type": "array", 
            "additionalItems": true, 
            "uniqueItems": true, 
            "items": {
              "$id": "syrianbear", 
              "title": "Empty Object", 
              "description": "This accepts anything, as long as it's valid JSON."
            }
          }
        }, 
        "required": [
          "id", 
          "anchortext", 
          "description", 
          "displaytext", 
          "dimensions"
        ]
      }
    }
  }, 
  "required": [
    "name", 
    "description", 
    "theme", 
    "data_format", 
    "stages"
  ]
}