{
    "name": "",
    "description": "",
    "theme": "default",
    "data_format": "tsv",
    "stages": [
        {
            "id": 1,
            "anchortext": "start",
            "description": "shows all available data in a cloud",
            "displaytext": "This cluster represents all 195 countries",
            "dimensions": []
        },
        {
            "id": 2,
            "anchortext": "devicetypes",
            "description": "cluster all forms by type",
            "displaytext": "Scaling by population shows the impact of India and China's proportion of world population.",
            "dimensions": [
                {
                    "name": "radius",
                    "properties": {
                        "by": "population"
                    }
                }
            ]
        },
        {
            "id": 2,
            "anchortext": "devicetypes",
            "description": "cluster all forms by type",
            "displaytext": "Coloring by life expectancy shows a lot of variation between countries",
            "dimensions": [
                {
                    "name": "radius",
                    "properties": {
                        "by": "population"
                    }
                },
                {
                    "name": "color",
                    "properties" : {
                        "by": "life_expectancy",
                        "palette": ["hsl(0,100%,50%)", "hsl(100,100%,70%)"]
                    }
                }
            ]
        },
        {
            "id": 2,
            "anchortext": "devicetypes",
            "description": "cluster all forms by type",
            "displaytext": "Grouping into Europe, Asia, Americas &amp; Africa<br> shows the life expectancy divide",
            "dimensions": [
                {
                    "name": "radius",
                    "properties": {
                        "by": "population"
                    }
                },
                {
                    "name": "color",
                    "properties" : {
                        "by": "life_expectancy",
                        "palette": ["hsl(0,100%,50%)", "hsl(100,100%,70%)"]
                    }
                },
                {
                    "name": "y",
                    "properties" : {
                        "by": "geo4",
                        "label": "Geo"
                    }
                }
            ]
        },
        {
            "id": 2,
            "anchortext": "devicetypes",
            "description": "cluster all forms by type",
            "displaytext": "Adding average income to the equation shows the divide between countries<br>The outlier in Asia is Qatar, with an average income of $130,000",
            "dimensions": [
                {
                    "name": "radius",
                    "properties": {
                        "by": "population"
                    }
                },
                {
                    "name": "color",
                    "properties" : {
                        "by": "life_expectancy",
                        "palette": ["hsl(0,100%,50%)", "hsl(100,100%,70%)"]
                    }
                },
                {
                    "name": "x",
                    "properties" : {
                        "by": "income",
                        "label": "Income"
                    }
                },
                {
                    "name": "y",
                    "properties" : {
                        "by": "geo4",
                        "label": "Geo"
                    }
                }
            ]
        }
    ]
}