{
    "name": "Titanic",
    "description": "Titanic",
    "theme": "default",
    "data_format": "tsv",
    "stages": [
        {
            "id": 1,
            "anchortext": "start",
            "description": "shows all available data in a cloud",
            "displaytext": "Each point in this cluster represents a passenger aboard the titanic.",
            "dimensions": []
        },
        {
            "id": 3,
            "anchortext": "start",
            "description": "shows all available data in a cloud",
            "displaytext": "60% of the passengers were male",
            "dimensions": [
                {
                    "name": "x",
                    "properties": {
                        "by": "sex"
                    }
                },
                {
                    "name": "color",
                    "properties": {
                        "by": "sex",
                        "palette": ["red","blue"]
                    }
                }
            ]
        },{
            "id": 4,
            "anchortext": "start",
            "description": "shows all available data in a cloud",
            "displaytext": "Male passengers were generally older than the female passengers.<br/>We don't have the age for 20% of passengers (the cluster on the left)",
            "dimensions": [
                {
                    "name": "x",
                    "properties": {
                        "by": "age"
                    }
                },
                {
                    "name": "y",
                    "properties": {
                        "by": "sex"
                    }
                },
                {
                    "name": "color",
                    "properties": {
                        "by": "sex",
                        "palette": ["red","blue"]
                    }
                }
            ]
        },{
            "id": 5,
            "anchortext": "start",
            "description": "shows all available data in a cloud",
            "displaytext": "Women were twice as likely to survive as men",
            "dimensions": [
                {
                    "name": "y",
                    "properties": {
                        "by": "sex"
                    }
                },
                {
                    "name": "color",
                    "properties": {
                        "by": "survived",
                        "palette": ["black","green"]
                    }
                }
            ]
        },{
            "id": 6,
            "anchortext": "start",
            "description": "shows all available data in a cloud",
            "displaytext": "The majority of deaths were in third class.<br/>Almost 100% of women in first class survived",
            "dimensions": [
                {
                    "name": "y",
                    "properties": {
                        "by": "sex"
                    }
                },
                {
                    "name": "x",
                    "properties": {
                        "by": "pclass"
                    }
                },
                {
                    "name": "color",
                    "properties": {
                        "by": "survived",
                        "palette": ["black","green"]
                    }
                }
            ]
        },{
            "id": 7,
            "anchortext": "start",
            "description": "shows all available data in a cloud",
            "displaytext": "The higher the fare, the less likely you were to die",
            "dimensions": [
                {
                    "name": "x",
                    "properties": {
                        "by": "fare"
                    }
                },
                {
                    "name": "color",
                    "properties": {
                        "by": "survived",
                        "palette": ["black","green"]
                    }
                }
            ]
        },{
            "id": 8,
            "anchortext": "start",
            "description": "shows all available data in a cloud",
            "displaytext": "Of course, more women survived than men",
            "dimensions": [
                {
                    "name": "x",
                    "properties": {
                        "by": "fare"
                    }
                },
                {
                    "name": "y",
                    "properties": {
                        "by": "sex"
                    }
                },
                {
                    "name": "color",
                    "properties": {
                        "by": "survived",
                        "palette": ["black","green"]
                    }
                }
            ]
        }
    ]
}